[
  {
    "schemaVersion": "0.2",
    "batchId": "Q20-003",
    "id": "g3-argon-0004",
    "revision": 3,
    "status": "machine_checked",
    "grade": 3,
    "gradeBasis": {
      "reference": "2022 개정 교육과정 초등학교 국어 3-1(나)",
      "editionYear": 2022,
      "unit": "5. 인물에게 마음을 전해요",
      "reviewed": true
    },
    "target": {
      "lemma": "짐작하다",
      "partOfSpeech": "동사",
      "senseKey": "짐작하다/동사/1"
    },
    "type": "definition",
    "stem": "‘표정을 보고 속마음을 짐작하다’에서 ‘짐작하다’의 뜻은?",
    "options": [
      {
        "id": "a",
        "text": "자기가 한 잘못을 사과하다"
      },
      {
        "id": "b",
        "text": "남의 말을 귀 기울여 잘 듣다"
      },
      {
        "id": "c",
        "text": "힘든 일을 끝까지 참고 견디다"
      },
      {
        "id": "d",
        "text": "모르는 일을 대강 생각해 알다"
      }
    ],
    "correctOptionId": "d",
    "explanation": "‘짐작하다’는 잘 모르는 일을 대강 생각해 알아낸다는 뜻이에요.",
    "distractorRationales": {
      "a": "‘자기가 한 잘못을 사과하다’는 미안한 마음을 전하는 일이에요.",
      "b": "‘남의 말을 귀 기울여 잘 듣다’는 잘 듣는 태도예요.",
      "c": "‘힘든 일을 끝까지 참고 견디다’는 참는 태도예요."
    },
    "source": {
      "provider": "stdict",
      "entryId": "484857",
      "senseId": "281576",
      "senseOrder": 1,
      "url": "https://stdict.korean.go.kr/search/searchView.do?word_no=484857&searchKeywordTo=3",
      "retrievedAt": "2026-10-28T02:05:00.000Z",
      "license": "표준국어대사전 뜻풀이 근거 확인, 용례 미복제",
      "evidenceHash": "16a96b463dc139e7b8988e75210367cc8d85af34287ba7de8f6b618f80f1ead1",
      "evidenceArtifactId": "g3-argon-0004.txt"
    },
    "review": {
      "reviewerId": null,
      "reviewedAt": null
    }
  },
  {
    "schemaVersion": "0.2",
    "batchId": "Q20-003",
    "id": "g3-argon-0006",
    "revision": 3,
    "status": "machine_checked",
    "grade": 3,
    "gradeBasis": {
      "reference": "2022 개정 교육과정 초등학교 국어 3-2(가)",
      "editionYear": 2022,
      "unit": "독서 단원. 계획대로 차근차근 읽어요",
      "reviewed": true
    },
    "target": {
      "lemma": "끈기",
      "partOfSpeech": "명사",
      "senseKey": "끈기/명사/2"
    },
    "type": "definition",
    "stem": "‘끈기를 가지고 줄넘기를 연습했어요’에서 ‘끈기’의 뜻은?",
    "options": [
      {
        "id": "a",
        "text": "무거운 물건을 번쩍 드는 힘"
      },
      {
        "id": "b",
        "text": "쉽게 그만두지 않고 버티는 힘"
      },
      {
        "id": "c",
        "text": "모르는 문제를 스스로 푸는 힘"
      },
      {
        "id": "d",
        "text": "자기 생각을 말로 전하는 힘"
      }
    ],
    "correctOptionId": "b",
    "explanation": "‘끈기’는 쉽게 포기하지 않고 끝까지 버티는 힘이에요.",
    "distractorRationales": {
      "a": "‘무거운 물건을 번쩍 드는 힘’은 몸의 힘을 뜻해요.",
      "c": "‘모르는 문제를 스스로 푸는 힘’은 공부하는 힘이에요.",
      "d": "‘자기 생각을 말로 전하는 힘’은 말하기와 관련된 힘이에요."
    },
    "source": {
      "provider": "stdict",
      "entryId": "56170",
      "senseId": "36129",
      "senseOrder": 2,
      "url": "https://stdict.korean.go.kr/search/searchView.do?word_no=56170&searchKeywordTo=3",
      "retrievedAt": "2026-10-28T02:05:00.000Z",
      "license": "표준국어대사전 뜻풀이 근거 확인, 용례 미복제",
      "evidenceHash": "bb05c9ebbf8816f2d42699d14f84516b9d33e2f76a28c3f6ceae5096407110ef",
      "evidenceArtifactId": "g3-argon-0006.txt"
    },
    "review": {
      "reviewerId": null,
      "reviewedAt": null
    }
  },
  {
    "schemaVersion": "0.2",
    "batchId": "Q20-003",
    "id": "g3-argon-0015",
    "revision": 3,
    "status": "machine_checked",
    "grade": 3,
    "gradeBasis": {
      "reference": "2022 개정 교육과정 초등학교 국어 3-1(나)",
      "editionYear": 2022,
      "unit": "5. 인물에게 마음을 전해요",
      "reviewed": true
    },
    "target": {
      "lemma": "소중하다",
      "partOfSpeech": "형용사",
      "senseKey": "소중하다/형용사/1"
    },
    "type": "cloze",
    "stem": "늘 내 곁을 지켜 주는 가족은 나에게 무엇과도 바꿀 수 없이 (    ).",
    "options": [
      {
        "id": "a",
        "text": "비좁아요"
      },
      {
        "id": "b",
        "text": "조용해요"
      },
      {
        "id": "c",
        "text": "소중해요"
      },
      {
        "id": "d",
        "text": "심심해요"
      }
    ],
    "correctOptionId": "c",
    "explanation": "‘소중하다’는 무엇과도 바꿀 수 없을 만큼 매우 중요하다는 뜻이에요.",
    "distractorRationales": {
      "a": "‘비좁아요’는 자리가 좁다는 뜻이라 가족에게 어울리지 않아요.",
      "b": "‘조용해요’는 소리가 나지 않는다는 뜻이라 문맥에 맞지 않아요.",
      "d": "‘심심해요’는 할 일이 없어 지루하다는 뜻이라 어울리지 않아요."
    },
    "source": {
      "provider": "stdict",
      "entryId": "196444",
      "senseId": "200316",
      "senseOrder": 1,
      "url": "https://stdict.korean.go.kr/search/searchView.do?word_no=196444&searchKeywordTo=3",
      "retrievedAt": "2026-10-28T02:05:00.000Z",
      "license": "표준국어대사전 뜻풀이 근거 확인, 용례 미복제",
      "evidenceHash": "a6fe58cc78dc1b24bb51d9e66e4193ffa973f3b1eb3d7dd783a86b3cc7f7f2ff",
      "evidenceArtifactId": "g3-argon-0015.txt"
    },
    "review": {
      "reviewerId": null,
      "reviewedAt": null
    }
  },
  {
    "schemaVersion": "0.2",
    "batchId": "Q20-003",
    "id": "g3-argon-0035",
    "revision": 1,
    "status": "machine_checked",
    "grade": 3,
    "gradeBasis": {
      "reference": "2022 개정 교육과정 초등학교 국어 3-2(나)",
      "editionYear": 2022,
      "unit": "4. 서로 존중하며 대화해요",
      "reviewed": true
    },
    "target": {
      "lemma": "맞장구",
      "partOfSpeech": "명사",
      "senseKey": "맞장구/명사/1"
    },
    "type": "definition",
    "stem": "‘친구 말에 맞장구를 치며 들었어요’에서 ‘맞장구’의 뜻은?",
    "options": [
      {
        "id": "a",
        "text": "모르는 말을 사전에서 찾는 일"
      },
      {
        "id": "b",
        "text": "남의 말에 맞다고 동의하는 일"
      },
      {
        "id": "c",
        "text": "무거운 짐을 두 손으로 드는 일"
      },
      {
        "id": "d",
        "text": "약속 시간에 늦지 않게 가는 일"
      }
    ],
    "correctOptionId": "b",
    "explanation": "여기서 ‘맞장구’는 남의 말에 그렇다고 함께 동의하는 일이에요.",
    "distractorRationales": {
      "a": "‘모르는 말을 사전에서 찾는 일’은 뜻을 찾아보는 행동이에요.",
      "c": "‘무거운 짐을 두 손으로 드는 일’은 물건을 드는 행동이에요.",
      "d": "‘약속 시간에 늦지 않게 가는 일’은 시간을 지키는 행동이에요."
    },
    "source": {
      "provider": "stdict",
      "entryId": "113331",
      "senseId": "404460",
      "senseOrder": 1,
      "url": "https://stdict.korean.go.kr/search/searchView.do?word_no=113331&searchKeywordTo=3",
      "retrievedAt": "2026-10-29T10:41:11.397Z",
      "license": "표준국어대사전 뜻풀이 근거 확인, 용례 미복제",
      "evidenceHash": "9a4e9de0b51636c53ad1a06ef1cf9a82f6d9e6202b2723ca86066261605d8917",
      "evidenceArtifactId": "맞장구-113331-1.txt"
    },
    "review": {
      "reviewerId": null,
      "reviewedAt": null
    }
  },
  {
    "schemaVersion": "0.2",
    "batchId": "Q20-003",
    "id": "g3-argon-0036",
    "revision": 1,
    "status": "machine_checked",
    "grade": 3,
    "gradeBasis": {
      "reference": "2022 개정 교육과정 초등학교 국어 3-1(나)",
      "editionYear": 2022,
      "unit": "5. 인물에게 마음을 전해요",
      "reviewed": true
    },
    "target": {
      "lemma": "살피다",
      "partOfSpeech": "동사",
      "senseKey": "살피다/동사/1"
    },
    "type": "definition",
    "stem": "‘길을 건너기 전에 양옆을 살폈어요’에서 ‘살피다’의 뜻은?",
    "options": [
      {
        "id": "a",
        "text": "마음을 쓰며 두루 자세히 보다"
      },
      {
        "id": "b",
        "text": "큰 소리로 친구 이름을 부르다"
      },
      {
        "id": "c",
        "text": "종이를 반듯하게 접어 자르다"
      },
      {
        "id": "d",
        "text": "약속 장소로 빠르게 달려가다"
      }
    ],
    "correctOptionId": "a",
    "explanation": "여기서 ‘살피다’는 주의를 기울여 두루 자세히 본다는 뜻이에요.",
    "distractorRationales": {
      "b": "‘큰 소리로 친구 이름을 부르다’는 소리 내어 부르는 일이에요.",
      "c": "‘종이를 반듯하게 접어 자르다’는 손으로 만드는 행동이에요.",
      "d": "‘약속 장소로 빠르게 달려가다’는 빨리 이동하는 행동이에요."
    },
    "source": {
      "provider": "stdict",
      "entryId": "441353",
      "senseId": "332165",
      "senseOrder": 1,
      "url": "https://stdict.korean.go.kr/search/searchView.do?word_no=441353&searchKeywordTo=3",
      "retrievedAt": "2026-10-29T10:41:10.717Z",
      "license": "표준국어대사전 뜻풀이 근거 확인, 용례 미복제",
      "evidenceHash": "759b7bd0616c60117989d6bf6c5a654d58120f36bec8509a58131d71c8003b11",
      "evidenceArtifactId": "살피다-441353-1.txt"
    },
    "review": {
      "reviewerId": null,
      "reviewedAt": null
    }
  },
  {
    "schemaVersion": "0.2",
    "batchId": "Q20-003",
    "id": "g3-argon-0037",
    "revision": 1,
    "status": "machine_checked",
    "grade": 3,
    "gradeBasis": {
      "reference": "2022 개정 교육과정 초등학교 국어 3-1(가)",
      "editionYear": 2022,
      "unit": "1. 생생하게 표현해요",
      "reviewed": true
    },
    "target": {
      "lemma": "데굴데굴",
      "partOfSpeech": "부사",
      "senseKey": "데굴데굴/부사/1"
    },
    "type": "cloze",
    "stem": "비탈길에서 큰 공이 아래로 (    ) 굴러갔어요.",
    "options": [
      {
        "id": "a",
        "text": "주룩주룩"
      },
      {
        "id": "b",
        "text": "소곤소곤"
      },
      {
        "id": "c",
        "text": "데굴데굴"
      },
      {
        "id": "d",
        "text": "무럭무럭"
      }
    ],
    "correctOptionId": "c",
    "explanation": "‘데굴데굴’은 큰 물건이 바닥을 계속 구르는 모양을 나타내요.",
    "distractorRationales": {
      "a": "‘주룩주룩’은 굵은 빗줄기가 빠르게 내리는 모양이에요.",
      "b": "‘소곤소곤’은 작은 목소리로 가만가만 이야기하는 모양이에요.",
      "d": "‘무럭무럭’은 힘차게 잘 자라는 모양이라 공에 쓰지 않아요."
    },
    "source": {
      "provider": "stdict",
      "entryId": "83829",
      "senseId": "515338",
      "senseOrder": 1,
      "url": "https://stdict.korean.go.kr/search/searchView.do?word_no=83829&searchKeywordTo=3",
      "retrievedAt": "2026-10-29T10:41:11.847Z",
      "license": "표준국어대사전 뜻풀이 근거 확인, 용례 미복제",
      "evidenceHash": "e41a0fa764228de82f0de0cb88ce2ea623ec0d5dda6caf8f09cd5889d648dbe3",
      "evidenceArtifactId": "데굴데굴-83829-1.txt"
    },
    "review": {
      "reviewerId": null,
      "reviewedAt": null
    }
  },
  {
    "schemaVersion": "0.2",
    "batchId": "Q20-003",
    "id": "g3-argon-0038",
    "revision": 1,
    "status": "machine_checked",
    "grade": 3,
    "gradeBasis": {
      "reference": "2022 개정 교육과정 초등학교 국어 3-1(나)",
      "editionYear": 2022,
      "unit": "5. 인물에게 마음을 전해요",
      "reviewed": true
    },
    "target": {
      "lemma": "속상하다",
      "partOfSpeech": "형용사",
      "senseKey": "속상하다/형용사/1"
    },
    "type": "cloze",
    "stem": "아끼던 색연필을 잃어버려서 하루 종일 마음이 (    ).",
    "options": [
      {